{
  "schema_version": 3,
  "task_id": "task_package_fixture",
  "route": "registered_mutation",
  "decision": "awaiting_one_use_approval",
  "host_authority": "registered-root-helper",
  "sandbox_policy": null,
  "execution_authorized": false,
  "agent_turn_authorized": false,
  "mutation_authorized": false,
  "authority": "registered-package-mutation",
  "reason": "exact package transaction awaits preview and fresh one-use approval",
  "action_id": null,
  "action_version": null,
  "procedure": null,
  "assessment_id": "assessment_package_fixture",
  "intent_class": "host_change",
  "risk": 3,
  "route_name": "registered_workflow",
  "target_digest": "aaaaaaaaaaaaaaaaaaaaaaaaaaaaaaaaaaaaaaaaaaaaaaaaaaaaaaaaaaaaaaaa",
  "plan_digest": "bbbbbbbbbbbbbbbbbbbbbbbbbbbbbbbbbbbbbbbbbbbbbbbbbbbbbbbbbbbbbbbb",
  "approval_required": true,
  "approval_state": "pending",
  "review_digest": "cccccccccccccccccccccccccccccccccccccccccccccccccccccccccccccccc",
  "policy_digest": "dddddddddddddddddddddddddddddddddddddddddddddddddddddddddddddddd"
}
