{
  "schema_version": 3,
  "task_id": "task_mutation_fixture",
  "route": "local_mutation",
  "decision": "awaiting_one_use_approval",
  "host_authority": "current-user-filesystem",
  "sandbox_policy": null,
  "execution_authorized": false,
  "agent_turn_authorized": false,
  "mutation_authorized": false,
  "authority": "bounded-local-mutation",
  "reason": "reviewed bounded mutation awaits a fresh exact user approval",
  "action_id": null,
  "action_version": null,
  "procedure": null,
  "assessment_id": "assessment_mutation_fixture",
  "intent_class": "host_change",
  "risk": 1,
  "route_name": "local_mutation",
  "target_digest": "aaaaaaaaaaaaaaaaaaaaaaaaaaaaaaaaaaaaaaaaaaaaaaaaaaaaaaaaaaaaaaaa",
  "plan_digest": "bbbbbbbbbbbbbbbbbbbbbbbbbbbbbbbbbbbbbbbbbbbbbbbbbbbbbbbbbbbbbbbb",
  "approval_required": true,
  "approval_state": "pending",
  "review_digest": "cccccccccccccccccccccccccccccccccccccccccccccccccccccccccccccccc",
  "policy_digest": "dddddddddddddddddddddddddddddddddddddddddddddddddddddddddddddddd"
}
