{
  "schema_version": 3,
  "task_id": "task_fixture",
  "route": "agent_conversation",
  "decision": "allow_scoped_execution",
  "host_authority": "agent-read-only",
  "sandbox_policy": "readOnly",
  "execution_authorized": true,
  "agent_turn_authorized": true,
  "mutation_authorized": false,
  "authority": "current-user-agent",
  "reason": "typed preflight resolved one scoped operation",
  "action_id": null,
  "action_version": null,
  "procedure": null,
  "assessment_id": "assessment_fixture",
  "intent_class": "inspect",
  "risk": 0,
  "route_name": "reviewed_bash",
  "target_digest": "aaaaaaaaaaaaaaaaaaaaaaaaaaaaaaaaaaaaaaaaaaaaaaaaaaaaaaaaaaaaaaaa",
  "plan_digest": null,
  "approval_required": false,
  "approval_state": "at_tool_boundary",
  "review_digest": null,
  "policy_digest": "bbbbbbbbbbbbbbbbbbbbbbbbbbbbbbbbbbbbbbbbbbbbbbbbbbbbbbbbbbbbbbbb"
}
