{
  "schema_version": 3,
  "task_id": "task_local_fixture",
  "route": "local_read",
  "decision": "allow_local_read_only",
  "host_authority": "none",
  "sandbox_policy": null,
  "execution_authorized": true,
  "agent_turn_authorized": false,
  "mutation_authorized": false,
  "authority": "bounded-local-read",
  "reason": "bounded deterministic local filesystem read",
  "action_id": null,
  "action_version": null,
  "procedure": null,
  "assessment_id": "assessment_local_fixture",
  "intent_class": "inspect",
  "risk": 0,
  "route_name": "local_read",
  "target_digest": "aaaaaaaaaaaaaaaaaaaaaaaaaaaaaaaaaaaaaaaaaaaaaaaaaaaaaaaaaaaaaaaa",
  "plan_digest": "bbbbbbbbbbbbbbbbbbbbbbbbbbbbbbbbbbbbbbbbbbbbbbbbbbbbbbbbbbbbbbbb",
  "approval_required": false,
  "approval_state": "not_required",
  "review_digest": null,
  "policy_digest": "cccccccccccccccccccccccccccccccccccccccccccccccccccccccccccccccc"
}
