{
  "schema_version": 3,
  "task_id": "task_registered_fixture",
  "route": "local_read",
  "decision": "allow_local_read_only",
  "host_authority": "none",
  "sandbox_policy": null,
  "execution_authorized": true,
  "agent_turn_authorized": false,
  "mutation_authorized": false,
  "authority": "registered-local-read",
  "reason": "registered deterministic local read",
  "action_id": "knowledge.search",
  "action_version": "1.0.0",
  "procedure": "knowledge.record@1.0.0",
  "assessment_id": "assessment_registered_fixture",
  "intent_class": "inspect",
  "risk": 0,
  "route_name": "registered_workflow",
  "target_digest": "dddddddddddddddddddddddddddddddddddddddddddddddddddddddddddddddd",
  "plan_digest": null,
  "approval_required": false,
  "approval_state": "not_required",
  "review_digest": null,
  "policy_digest": "eeeeeeeeeeeeeeeeeeeeeeeeeeeeeeeeeeeeeeeeeeeeeeeeeeeeeeeeeeeeeeee"
}
